{
  "contract": "graph/1",
  "subject": "org/lanternworks",
  "generated": "2026-09-28T00:00:00Z",
  "nodes": [
    {
      "id": "org/lanternworks",
      "kind": "org",
      "label": "Lanternworks (fictional)",
      "source": "https://lanternworks.example/.well-known/flashyos.json"
    },
    {
      "id": "agent/lanternworks-courier",
      "kind": "agent",
      "label": "courier",
      "source": "https://lanternworks.example/.well-known/directory.json"
    },
    {
      "id": "capability/deliver",
      "kind": "capability",
      "label": "deliver",
      "source": "https://lanternworks.example/.well-known/flashyos-charter.json"
    }
  ],
  "edges": [
    {
      "id": "edge/lanternworks-operates-courier",
      "from": "org/lanternworks",
      "to": "agent/lanternworks-courier",
      "kind": "operates",
      "asserted_by": "org/lanternworks",
      "basis": "https://lanternworks.example/.well-known/directory.json",
      "at": "2026-09-28T00:00:00Z"
    },
    {
      "id": "edge/courier-offers-deliver",
      "from": "agent/lanternworks-courier",
      "to": "capability/deliver",
      "kind": "offers",
      "asserted_by": "org/lanternworks",
      "basis": "https://lanternworks.example/.well-known/flashyos-charter.json",
      "at": "2026-09-28T00:00:00Z"
    }
  ]
}
